{
  "schema_version": "1.0.0",
  "report_id": "synthetic-watch",
  "status": "COMPLETE",
  "generated_at": "2026-08-24T00:00:00Z",
  "as_of_date": "2026-08-24",
  "company": {
    "ticker": "TEST",
    "name": "Synthetic Test Company",
    "cik": "0000000001",
    "exchange": "NASDAQ",
    "security_type": "COMMON_STOCK",
    "sector": "Technology",
    "industry": "Software"
  },
  "market": {
    "current_price": 200.0,
    "currency": "USD",
    "price_timestamp": "2026-08-24T20:00:00Z",
    "treasury_yield": 0.04,
    "treasury_maturity_months": 24
  },
  "scope": {
    "investment_horizon_months": 24,
    "explicit_forecast_years": 5
  },
  "recommendation": {
    "action": "WATCH",
    "business_quality": "Strong",
    "investment_attractiveness": "Watchlist",
    "confidence": "Medium",
    "intrinsic_value_as_of_range": {
      "bear": 145.0,
      "base": 230.0,
      "bull": 285.0,
      "currency": "USD"
    },
    "horizon_target_range": {
      "bear": 155.0,
      "base": 240.0,
      "bull": 300.0,
      "currency": "USD"
    },
    "base_case_total_return": 0.21,
    "expected_total_return": 0.17875,
    "expected_annualized_return": 0.08570253753042323,
    "risk_premium": 0.04570253753042323,
    "margin_of_safety": 0.13043478260869565,
    "decision_hurdle": 0.1,
    "rationale": "Expected return and margin of safety are below BUY thresholds."
  },
  "summary": {
    "core_thesis": [
      "Synthetic recurring revenue supports durable cash generation.",
      "Current valuation does not offer enough expected return."
    ],
    "why_now": "The synthetic case tests deterministic policy behavior.",
    "primary_risk": "Growth may fall below the base assumption."
  },
  "business": {
    "summary": "Revenue is driven by customers multiplied by usage and price.",
    "claim_ids": ["C1"]
  },
  "industry_competition": {
    "summary": "Switching costs support a moderate competitive position.",
    "claim_ids": ["C1"],
    "competitive_advantage": "Moderate"
  },
  "financial_analysis": {
    "summary": "The synthetic company has positive free cash flow.",
    "claim_ids": ["C1"],
    "historical_years": 5,
    "metric_definitions": {
      "FCF": "Operating cash flow minus capital expenditures",
      "ROIC": "NOPAT divided by average invested capital"
    }
  },
  "future_drivers": [
    {
      "name": "Customer growth",
      "claim": "Customers are expected to grow.",
      "economic_mechanism": "More customers increase recurring revenue.",
      "financial_impact": "Revenue and free cash flow increase.",
      "valuation_impact": "Higher cash flow increases intrinsic value.",
      "evidence_claim_ids": ["C1"]
    },
    {
      "name": "Pricing",
      "claim": "Pricing is expected to remain stable.",
      "economic_mechanism": "Stable pricing preserves unit economics.",
      "financial_impact": "Gross margin remains stable.",
      "valuation_impact": "Stable margins support the base value.",
      "evidence_claim_ids": ["C1"]
    },
    {
      "name": "Reinvestment",
      "claim": "Reinvestment supports forecast growth.",
      "economic_mechanism": "Product investment sustains customer demand.",
      "financial_impact": "Growth requires ongoing capital allocation.",
      "valuation_impact": "Reinvestment constrains near-term cash flow.",
      "evidence_claim_ids": ["C1"]
    }
  ],
  "management": {
    "summary": "Management is evaluated on execution and capital allocation.",
    "claim_ids": ["C1"]
  },
  "valuation": {
    "methods": [
      {
        "type": "DCF",
        "applicable": true,
        "result": "Base intrinsic value is USD 230.",
        "key_assumptions": ["Five-year explicit forecast"],
        "sensitivity": "Value is sensitive to WACC and terminal growth."
      },
      {
        "type": "RELATIVE",
        "applicable": true,
        "result": "Relative valuation supports the base range.",
        "key_assumptions": ["Comparable peer economics"],
        "sensitivity": "Value changes with the selected peer group."
      },
      {
        "type": "REVERSE_DCF",
        "applicable": true,
        "result": "Current price implies durable growth.",
        "key_assumptions": ["Current market price"],
        "sensitivity": "Implied growth changes with the discount rate."
      }
    ],
    "model_reconciliation": "Methods are cross-checks and are not averaged."
  },
  "market_expectations": {
    "priced_in": "The market appears to expect durable growth.",
    "our_view": "Growth is plausible but the price offers limited return.",
    "difference": "The base case uses a wider downside range.",
    "supporting_claim_ids": ["C1"],
    "why_market_may_be_wrong": "The market may extrapolate recent growth."
  },
  "counter_thesis": {
    "strongest_counter_evidence": [
      "Growth may remain above the base assumption."
    ],
    "source_claim_ids": ["C1"],
    "reconsideration": "The counter-evidence supports WATCH instead of AVOID."
  },
  "scenarios": [
    {
      "name": "Bear",
      "probability": 0.25,
      "intrinsic_value_as_of": 145.0,
      "target_value_at_horizon": 155.0,
      "cumulative_dividends": 2.0,
      "total_return": -0.215,
      "annualized_return": -0.11399774266653251,
      "driver_assumptions": ["Growth slows materially."]
    },
    {
      "name": "Base",
      "probability": 0.5,
      "intrinsic_value_as_of": 230.0,
      "target_value_at_horizon": 240.0,
      "cumulative_dividends": 2.0,
      "total_return": 0.21,
      "annualized_return": 0.10000000000000009,
      "driver_assumptions": ["Growth and margins remain stable."]
    },
    {
      "name": "Bull",
      "probability": 0.25,
      "intrinsic_value_as_of": 285.0,
      "target_value_at_horizon": 300.0,
      "cumulative_dividends": 2.0,
      "total_return": 0.51,
      "annualized_return": 0.22882057274445078,
      "driver_assumptions": ["Growth and margins exceed the base case."]
    }
  ],
  "catalysts": [],
  "risks": [
    {
      "description": "Customer growth may slow.",
      "probability": "Medium",
      "impact": "High",
      "evidence_claim_ids": ["C1"],
      "leading_indicators": ["Customer additions"],
      "thesis_implication": "Lower growth reduces expected cash flow.",
      "invalidation_condition": "Customer growth remains below base for two periods."
    }
  ],
  "conclusion": {
    "reason": "The company is strong but valuation is not attractive enough.",
    "unresolved_questions": [],
    "next_checks": ["Review the next synthetic update."],
    "upgrade_conditions": ["Expected return and margin of safety exceed thresholds."],
    "downgrade_conditions": ["Expected return becomes non-positive."]
  },
  "claims": [
    {
      "id": "C1",
      "type": "FACT",
      "text": "This is a versioned synthetic evaluation fixture.",
      "material": true,
      "source_ids": ["S1"],
      "reasoning": null
    }
  ],
  "sources": [
    {
      "id": "S1",
      "tier": 1,
      "publisher": "Fulcrum",
      "title": "Synthetic Contract Fixture",
      "url": "https://example.com/synthetic-contract-fixture",
      "published_at": "2026-08-24T00:00:00Z",
      "retrieved_at": "2026-08-24T00:00:00Z",
      "available_as_of": "2026-08-24T00:00:00Z",
      "period": "Synthetic",
      "locator": "Fixture C1",
      "content_hash": null
    }
  ],
  "audit": {
    "latest_filings_checked": true,
    "point_in_time_checked": true,
    "citations_checked": true,
    "calculations_checked": true,
    "counter_thesis_checked": true,
    "schema_checked": true,
    "critical_gaps": []
  }
}
